{
  "status": "ok",
  "chartType": "area",
  "mode": "explicit",
  "spec": {
    "$schema": "https://vega.github.io/schema/vega-lite/v6.json",
    "title": "Area chart",
    "description": "Area chart of sum of revenue by quarter.",
    "data": {
      "values": [
        {
          "region": "North",
          "quarter": "2024-01",
          "revenue": 120000,
          "units": 340
        },
        {
          "region": "South",
          "quarter": "2024-01",
          "revenue": 135000,
          "units": 410
        },
        {
          "region": "North",
          "quarter": "2024-02",
          "revenue": 128000,
          "units": 360
        },
        {
          "region": "South",
          "quarter": "2024-02",
          "revenue": 142000,
          "units": 430
        },
        {
          "region": "North",
          "quarter": "2024-03",
          "revenue": 131000,
          "units": 372
        },
        {
          "region": "South",
          "quarter": "2024-03",
          "revenue": 150000,
          "units": 455
        }
      ]
    },
    "config": {
      "background": "#041620",
      "font": "'DM Sans', 'Helvetica Neue', Helvetica, Arial, sans-serif",
      "title": {
        "color": "#DBE6F2",
        "font": "'DM Sans', 'Helvetica Neue', Helvetica, Arial, sans-serif",
        "fontSize": 24,
        "fontWeight": 600,
        "anchor": "start"
      },
      "axis": {
        "titleColor": "#DBE6F2",
        "titleFont": "'DM Sans', 'Helvetica Neue', Helvetica, Arial, sans-serif",
        "labelColor": "#C8D2DE",
        "labelFont": "'DM Sans', 'Helvetica Neue', Helvetica, Arial, sans-serif",
        "gridColor": "#465862",
        "domainColor": "#414C58",
        "tickColor": "#414C58"
      },
      "axisX": {
        "grid": false
      },
      "axisY": {
        "grid": true
      },
      "legend": {
        "titleColor": "#DBE6F2",
        "titleFont": "'DM Sans', 'Helvetica Neue', Helvetica, Arial, sans-serif",
        "labelColor": "#C8D2DE",
        "labelFont": "'DM Sans', 'Helvetica Neue', Helvetica, Arial, sans-serif"
      },
      "view": {
        "stroke": null
      }
    },
    "usermeta": {
      "oods": {
        "specId": "viz:area",
        "name": "Area chart",
        "portability": {
          "tableColumnOrder": [
            "quarter",
            "revenue",
            "region",
            "units"
          ]
        },
        "a11y": {
          "description": "Area chart of sum of revenue by quarter.",
          "ariaLabel": "Area chart of Revenue by Quarter"
        }
      }
    },
    "mark": {
      "type": "area",
      "color": "#517FED"
    },
    "encoding": {
      "x": {
        "field": "quarter",
        "type": "temporal",
        "scale": {
          "type": "utc"
        },
        "title": "Quarter"
      },
      "y": {
        "field": "revenue",
        "type": "quantitative",
        "aggregate": "sum",
        "title": "Revenue"
      }
    }
  },
  "a11yDescription": "Area chart of sum of revenue by quarter.",
  "warnings": [],
  "output": {
    "compact": true,
    "echarts": true,
    "includeNormalizedSpec": true,
    "svg": true
  },
  "meta": {
    "renderer": "vega-lite",
    "mark": "MarkArea",
    "rowCount": 6,
    "fields": [
      "region",
      "quarter",
      "revenue",
      "units"
    ]
  },
  "normalizedSpec": {
    "$schema": "https://oods.dev/viz-spec/v1",
    "id": "viz:area",
    "name": "Area chart",
    "data": {
      "values": [
        {
          "region": "North",
          "quarter": "2024-01",
          "revenue": 120000,
          "units": 340
        },
        {
          "region": "South",
          "quarter": "2024-01",
          "revenue": 135000,
          "units": 410
        },
        {
          "region": "North",
          "quarter": "2024-02",
          "revenue": 128000,
          "units": 360
        },
        {
          "region": "South",
          "quarter": "2024-02",
          "revenue": 142000,
          "units": 430
        },
        {
          "region": "North",
          "quarter": "2024-03",
          "revenue": 131000,
          "units": 372
        },
        {
          "region": "South",
          "quarter": "2024-03",
          "revenue": 150000,
          "units": 455
        }
      ]
    },
    "marks": [
      {
        "trait": "MarkArea"
      }
    ],
    "encoding": {
      "x": {
        "field": "quarter",
        "trait": "EncodingPositionX",
        "channel": "x",
        "scale": "temporal",
        "title": "Quarter"
      },
      "y": {
        "field": "revenue",
        "trait": "EncodingPositionY",
        "channel": "y",
        "aggregate": "sum",
        "title": "Revenue"
      }
    },
    "a11y": {
      "description": "Area chart of sum of revenue by quarter.",
      "ariaLabel": "Area chart of Revenue by Quarter"
    },
    "portability": {
      "tableColumnOrder": [
        "quarter",
        "revenue",
        "region",
        "units"
      ]
    }
  },
  "echartsSpec": {
    "dataset": [
      {
        "id": "viz:area:dataset",
        "source": [
          {
            "region": "North",
            "quarter": "2024-01",
            "revenue": 120000,
            "units": 340
          },
          {
            "region": "South",
            "quarter": "2024-01",
            "revenue": 135000,
            "units": 410
          },
          {
            "region": "North",
            "quarter": "2024-02",
            "revenue": 128000,
            "units": 360
          },
          {
            "region": "South",
            "quarter": "2024-02",
            "revenue": 142000,
            "units": 430
          },
          {
            "region": "North",
            "quarter": "2024-03",
            "revenue": 131000,
            "units": 372
          },
          {
            "region": "South",
            "quarter": "2024-03",
            "revenue": 150000,
            "units": 455
          }
        ],
        "dimensions": [
          "region",
          "quarter",
          "revenue",
          "units"
        ]
      }
    ],
    "series": [
      {
        "type": "line",
        "datasetId": "viz:area:dataset",
        "encode": {
          "x": "quarter",
          "y": "revenue",
          "tooltip": [
            "quarter",
            "revenue"
          ]
        },
        "areaStyle": {
          "opacity": 0.3
        }
      }
    ],
    "xAxis": {
      "type": "time",
      "name": "Quarter",
      "nameLocation": "end",
      "boundaryGap": true
    },
    "yAxis": {
      "type": "value",
      "name": "Revenue",
      "nameLocation": "end"
    },
    "useUTC": true,
    "tooltip": {
      "trigger": "axis",
      "axisPointer": {
        "type": "shadow"
      }
    },
    "aria": {
      "enabled": true,
      "description": "Area chart of sum of revenue by quarter.",
      "label": {
        "enabled": true,
        "description": "Area chart of Revenue by Quarter"
      }
    },
    "title": {
      "text": "Area chart"
    },
    "usermeta": {
      "oods": {
        "specId": "viz:area",
        "name": "Area chart",
        "a11y": {
          "description": "Area chart of sum of revenue by quarter.",
          "ariaLabel": "Area chart of Revenue by Quarter"
        },
        "portability": {
          "tableColumnOrder": [
            "quarter",
            "revenue",
            "region",
            "units"
          ]
        }
      }
    }
  },
  "tokenCssRef": "tokens.build",
  "specRef": "viz.render-ed556256",
  "specRefCreatedAt": "2026-09-12T07:30:35.625Z",
  "specRefExpiresAt": "2026-09-12T08:00:35.625Z",
  "contentHash": "89c6c90f4055bc88b8a1c2330bcd05ef79ed9ac12bbe2f2b2c25d35806c9ccaa",